{"$id":"https://surfaces.dev/schemas/source-accessibility-policy/source-accessibility-policy-expectations.v0.schema.json","$schema":"https://json-schema.org/draft/2020-12/schema","additionalProperties":false,"properties":{"diagnosticsRegistry":{"items":{"additionalProperties":false,"properties":{"artifactPath":{"minLength":1,"type":"string"},"canonicalMessage":{"minLength":1,"type":"string"},"code":{"minLength":1,"type":"string"},"diagnosticSource":{"minLength":1,"type":"string"},"fixtureCoverage":{"minLength":1,"type":"string"},"jsonPointer":{"minLength":1,"type":"string"},"phase":{"minLength":1,"type":"string"},"promotionStatus":{"enum":["allowed","review_required","blocked"]},"severity":{"enum":["error","review"]},"sourceRef":{"anyOf":[{"minLength":1,"type":"string"},{"type":"null"}]},"stage":{"minLength":1,"type":"string"},"suggestedAction":{"minLength":1,"type":"string"}},"required":["code","canonicalMessage","severity","stage","phase","promotionStatus","artifactPath","jsonPointer","sourceRef","suggestedAction","fixtureCoverage","diagnosticSource"],"type":"object"},"minItems":1,"type":"array"},"expectations":{"items":{"additionalProperties":false,"properties":{"artifactPath":{"minLength":1,"type":"string"},"diagnosticCodes":{"items":{"minLength":1,"type":"string"},"type":"array","uniqueItems":true},"expectedResult":{"enum":["valid","review_required","invalid"]},"fixturePath":{"minLength":1,"type":"string"},"jsonPointer":{"minLength":1,"type":"string"},"kind":{"enum":["valid","review","invalid","mutation"]},"promotionStatus":{"enum":["allowed","review_required","blocked"]}},"required":["fixturePath","kind","expectedResult","promotionStatus","diagnosticCodes","artifactPath","jsonPointer"],"type":"object"},"minItems":1,"type":"array"},"fixtureRoot":{"const":"fixtures/source-accessibility-policy"},"inputs":{"items":{"minLength":1,"type":"string"},"minItems":1,"type":"array","uniqueItems":true},"runExpectation":{"additionalProperties":false,"properties":{"behaviorStatuses":{"const":[{"behaviorId":"button-accessible-name","status":"allowed"},{"behaviorId":"button-keyboard-activation","status":"allowed"},{"behaviorId":"button-focus-visible","status":"review_required"},{"behaviorId":"inline-alert-status-announcement","status":"allowed"},{"behaviorId":"button-contrast-token","status":"review_required"}]},"promotionStatus":{"const":"review_required"},"status":{"const":"pass"},"summary":{"const":{"allowedCount":3,"behaviorCount":5,"blockedCount":0,"reviewRequiredCount":2}}},"required":["status","promotionStatus","summary","behaviorStatuses"],"type":"object"},"schemaId":{"const":"source-accessibility-policy-expectations.v0"},"schemaRoot":{"const":"schemas"},"sourceRoot":{"const":"sources/source-accessibility-policy"},"version":{"const":"0.0.0"}},"required":["schemaId","version","schemaRoot","sourceRoot","fixtureRoot","inputs","diagnosticsRegistry","expectations","runExpectation"],"type":"object"}