{"diagnosticsRegistry":[{"artifactPath":"fixtures/source-accessibility-policy/mutations/missing-upstream-evidence.source-accessibility-policy-preflight.json","canonicalMessage":"Required upstream accessibility authority evidence is missing or not passing.","code":"SOURCE_ACCESSIBILITY_UPSTREAM_EVIDENCE_MISSING","diagnosticSource":"source-accessibility-policy-preflight","fixtureCoverage":"mutations/missing-upstream-evidence.source-accessibility-policy-preflight.json","jsonPointer":"/upstreamPath","phase":"source-accessibility-policy-preflight","promotionStatus":"blocked","severity":"error","sourceRef":null,"stage":"preflight","suggestedAction":"Restore accepted P2, source-conformance, and source-family packaging evidence."},{"artifactPath":"fixtures/source-accessibility-policy/mutations/upstream-hash-mismatch.source-accessibility-policy-preflight.json","canonicalMessage":"Upstream accessibility authority evidence does not match the accepted artifact hash.","code":"SOURCE_ACCESSIBILITY_UPSTREAM_HASH_MISMATCH","diagnosticSource":"source-accessibility-policy-preflight","fixtureCoverage":"mutations/upstream-hash-mismatch.source-accessibility-policy-preflight.json","jsonPointer":"/upstreamPath","phase":"source-accessibility-policy-preflight","promotionStatus":"blocked","severity":"error","sourceRef":null,"stage":"preflight","suggestedAction":"Regenerate accepted upstream proof evidence before accessibility policy reconciliation."},{"artifactPath":"fixtures/source-accessibility-policy/mutations/source-hash-mismatch.source-accessibility-policy.json","canonicalMessage":"Structured accessibility behavior source bytes do not match the manifest.","code":"SOURCE_ACCESSIBILITY_SOURCE_HASH_MISMATCH","diagnosticSource":"source-accessibility-policy-source","fixtureCoverage":"mutations/source-hash-mismatch.source-accessibility-policy.json","jsonPointer":"/sourceFiles/0/sha256","phase":"source-accessibility-policy-source","promotionStatus":"blocked","severity":"error","sourceRef":"source-accessibility-policy://manifest.json#/","stage":"source","suggestedAction":"Review and rebind the checked structured declaration source."},{"artifactPath":"fixtures/source-accessibility-policy/invalid/free-form-policy-text.source-accessibility-policy.json","canonicalMessage":"Free-form policy text cannot define accessibility behavior authority.","code":"SOURCE_ACCESSIBILITY_FREE_FORM_POLICY_FORBIDDEN","diagnosticSource":"source-accessibility-policy-conformance","fixtureCoverage":"invalid/free-form-policy-text.source-accessibility-policy.json","jsonPointer":"/freeFormPolicyText","phase":"source-accessibility-policy-structure","promotionStatus":"blocked","severity":"error","sourceRef":null,"stage":"conformance","suggestedAction":"Replace policy prose with closed structured assertions, operators, values, and source refs."},{"artifactPath":"fixtures/source-accessibility-policy/invalid/policy-catalog-conflict.source-accessibility-policy.json","canonicalMessage":"Structured accessibility behavior contradicts the accepted catalog.","code":"SOURCE_ACCESSIBILITY_POLICY_CATALOG_CONFLICT","diagnosticSource":"source-accessibility-policy-conformance","fixtureCoverage":"invalid/policy-catalog-conflict.source-accessibility-policy.json","jsonPointer":"/declarationOverride/assertions/0","phase":"source-accessibility-policy-conflict","promotionStatus":"blocked","severity":"error","sourceRef":null,"stage":"conformance","suggestedAction":"Correct the structured declaration or update source authority through a separate proven ingestion boundary."},{"artifactPath":"fixtures/source-accessibility-policy/invalid/unsupported-behavior.source-accessibility-policy.json","canonicalMessage":"Structured accessibility behavior is unsupported by the accepted catalog.","code":"SOURCE_ACCESSIBILITY_REQUIREMENT_UNSUPPORTED","diagnosticSource":"source-accessibility-policy-conformance","fixtureCoverage":"invalid/unsupported-behavior.source-accessibility-policy.json","jsonPointer":"/declarationOverride/assertions/0/catalogPointer","phase":"source-accessibility-policy-coverage","promotionStatus":"blocked","severity":"error","sourceRef":null,"stage":"conformance","suggestedAction":"Add an authoritative catalog fact through a separate proof or route the unresolved declaration to review."},{"artifactPath":"fixtures/source-accessibility-policy/review/ambiguous-mapping.source-accessibility-policy.json","canonicalMessage":"Structured accessibility behavior mapping is ambiguous and requires owner review.","code":"SOURCE_ACCESSIBILITY_MAPPING_AMBIGUOUS","diagnosticSource":"source-accessibility-policy-review","fixtureCoverage":"review/ambiguous-mapping.source-accessibility-policy.json","jsonPointer":"/ambiguity","phase":"source-accessibility-policy-review","promotionStatus":"review_required","severity":"review","sourceRef":null,"stage":"review","suggestedAction":"Resolve the catalog pointer mapping or preserve a non-executable owner-bound review item."},{"artifactPath":"fixtures/source-accessibility-policy/review/focus-visible-unproven.source-accessibility-policy.json","canonicalMessage":"Structured accessibility behavior lacks an authoritative catalog fact and requires owner review.","code":"SOURCE_ACCESSIBILITY_REVIEW_REQUIRED","diagnosticSource":"source-accessibility-policy-review","fixtureCoverage":"review/focus-visible-unproven.source-accessibility-policy.json","jsonPointer":"/behaviorId","phase":"source-accessibility-policy-review","promotionStatus":"review_required","severity":"review","sourceRef":null,"stage":"review","suggestedAction":"Add the missing structured fact through authority or complete the declared review route."},{"artifactPath":"fixtures/source-accessibility-policy/invalid/review-owner-missing.source-accessibility-policy.json","canonicalMessage":"Accessibility review-required output must include a declared owner.","code":"SOURCE_ACCESSIBILITY_REVIEW_OWNER_MISSING","diagnosticSource":"source-accessibility-policy-review","fixtureCoverage":"invalid/review-owner-missing.source-accessibility-policy.json","jsonPointer":"/reviewRouteMutation/owner","phase":"source-accessibility-policy-review","promotionStatus":"blocked","severity":"error","sourceRef":null,"stage":"review","suggestedAction":"Restore the owner on the structured non-executable review route."},{"artifactPath":"fixtures/source-accessibility-policy/invalid/authority-escalation.source-accessibility-policy.json","canonicalMessage":"Accessibility policy reconciliation attempted to add catalog capability.","code":"SOURCE_ACCESSIBILITY_AUTHORITY_ESCALATION","diagnosticSource":"source-accessibility-policy-conformance","fixtureCoverage":"invalid/authority-escalation.source-accessibility-policy.json","jsonPointer":"/catalogMutation/catalogPointer","phase":"source-accessibility-policy-authority","promotionStatus":"blocked","severity":"error","sourceRef":null,"stage":"conformance","suggestedAction":"Keep assertions under the existing Button or InLineAlert accessibility and token-ref boundary."},{"artifactPath":"fixtures/source-accessibility-policy/invalid/source-ref-missing.source-accessibility-policy.json","canonicalMessage":"Structured accessibility behavior must include declared policy and fact source refs.","code":"SOURCE_ACCESSIBILITY_SOURCE_REF_MISSING","diagnosticSource":"source-accessibility-policy-conformance","fixtureCoverage":"invalid/source-ref-missing.source-accessibility-policy.json","jsonPointer":"/declarationOverride/assertions/0/sourceRefs","phase":"source-accessibility-policy-source-refs","promotionStatus":"blocked","severity":"error","sourceRef":null,"stage":"conformance","suggestedAction":"Bind the assertion to the checked declaration, policy requirement, and catalog fact source refs."},{"artifactPath":"fixtures/source-accessibility-policy/invalid/precedence-unresolved.source-accessibility-policy.json","canonicalMessage":"Accessibility behavior source conflict lacks an explicit policy-authorized resolution.","code":"SOURCE_ACCESSIBILITY_PRECEDENCE_UNRESOLVED","diagnosticSource":"source-accessibility-policy-conformance","fixtureCoverage":"invalid/precedence-unresolved.source-accessibility-policy.json","jsonPointer":"/authorityConflict/resolutionMode","phase":"source-accessibility-policy-precedence","promotionStatus":"blocked","severity":"error","sourceRef":null,"stage":"conformance","suggestedAction":"Declare primary precedence with the checked source-precedence policy or route the conflict to review."},{"artifactPath":"fixtures/source-accessibility-policy/mutations/evidence-hash-mismatch.source-accessibility-policy.json","canonicalMessage":"Accessibility policy report or evidence hash does not match the generated proof closure.","code":"SOURCE_ACCESSIBILITY_EVIDENCE_HASH_MISMATCH","diagnosticSource":"source-accessibility-policy-evidence","fixtureCoverage":"mutations/evidence-hash-mismatch.source-accessibility-policy.json","jsonPointer":"/artifacts/0/hash","phase":"source-accessibility-policy-evidence","promotionStatus":"blocked","severity":"error","sourceRef":null,"stage":"evidence","suggestedAction":"Regenerate accessibility policy artifacts and evidence from checked inputs."}],"expectations":[{"artifactPath":"artifacts/source-accessibility-policy/accessibility-policy-conformance-report.json","diagnosticCodes":[],"expectedResult":"valid","fixturePath":"fixtures/source-accessibility-policy/valid/button-accessible-name.source-accessibility-policy.json","jsonPointer":"/behaviorId","kind":"valid","promotionStatus":"allowed"},{"artifactPath":"artifacts/source-accessibility-policy/accessibility-policy-conformance-report.json","diagnosticCodes":[],"expectedResult":"valid","fixturePath":"fixtures/source-accessibility-policy/valid/button-keyboard-activation.source-accessibility-policy.json","jsonPointer":"/behaviorId","kind":"valid","promotionStatus":"allowed"},{"artifactPath":"artifacts/source-accessibility-policy/accessibility-policy-conformance-report.json","diagnosticCodes":[],"expectedResult":"valid","fixturePa